{
  "kind": "experiment",
  "id": "9697de03f7061aa26360c427ef463a04",
  "inputDigest": "sha256:0e507a53080179eced7cf8148798d7ddbc81de276c822abbb8a1503622daab6c",
  "profile": "quick",
  "inputs": {
    "design": {
      "field": "gf256",
      "matrix": [
        [
          "02",
          "03",
          "01",
          "01"
        ],
        [
          "01",
          "02",
          "03",
          "01"
        ],
        [
          "01",
          "01",
          "02",
          "03"
        ],
        [
          "03",
          "01",
          "01",
          "02"
        ]
      ],
      "model": "aes-like/gf256/v1",
      "offsets": [
        0,
        1,
        2,
        3
      ],
      "rounds": 4,
      "sbox": {
        "kind": "aes"
      },
      "width": 4
    },
    "profile": "quick",
    "program": {
      "field": "gf256",
      "instructions": [
        {
          "a": 0,
          "b": 1,
          "op": "add"
        },
        {
          "a": 4,
          "b": 2,
          "op": "add"
        },
        {
          "a": 5,
          "b": 3,
          "op": "add"
        },
        {
          "a": 0,
          "b": 1,
          "op": "add"
        },
        {
          "a": 7,
          "k": "02",
          "op": "mul"
        },
        {
          "a": 0,
          "b": 8,
          "op": "add"
        },
        {
          "a": 9,
          "b": 6,
          "op": "add"
        },
        {
          "a": 1,
          "b": 2,
          "op": "add"
        },
        {
          "a": 11,
          "k": "02",
          "op": "mul"
        },
        {
          "a": 1,
          "b": 12,
          "op": "add"
        },
        {
          "a": 13,
          "b": 6,
          "op": "add"
        },
        {
          "a": 2,
          "b": 3,
          "op": "add"
        },
        {
          "a": 15,
          "k": "02",
          "op": "mul"
        },
        {
          "a": 2,
          "b": 16,
          "op": "add"
        },
        {
          "a": 17,
          "b": 6,
          "op": "add"
        },
        {
          "a": 3,
          "b": 0,
          "op": "add"
        },
        {
          "a": 19,
          "k": "02",
          "op": "mul"
        },
        {
          "a": 3,
          "b": 20,
          "op": "add"
        },
        {
          "a": 21,
          "b": 6,
          "op": "add"
        }
      ],
      "name": "aes-shared-sum",
      "outputs": [
        10,
        14,
        18,
        22
      ],
      "width": 4
    }
  },
  "search": {
    "seed": "26e6b3d3da9145b2",
    "budget": {
      "maxCandidates": 8,
      "profile": "quick",
      "requested": {
        "maxCandidates": 8,
        "synthMs": 10000
      },
      "shortlist": 1,
      "synthMs": 10000,
      "totalMs": 180000
    },
    "generated": 8,
    "history": [
      {
        "id": "c1",
        "ops": {
          "add": 12,
          "mul": 4
        },
        "depth": 3,
        "temps": 5,
        "symbolic": "pass"
      },
      {
        "id": "c2",
        "ops": {
          "add": 12,
          "mul": 4
        },
        "depth": 3,
        "temps": 6,
        "symbolic": "pass"
      },
      {
        "id": "c3",
        "ops": {
          "add": 12,
          "mul": 4
        },
        "depth": 4,
        "temps": 5,
        "symbolic": "pass"
      },
      {
        "id": "c4",
        "ops": {
          "add": 12,
          "mul": 4
        },
        "depth": 5,
        "temps": 5,
        "symbolic": "pass"
      },
      {
        "id": "c5",
        "ops": {
          "add": 12,
          "mul": 5
        },
        "depth": 3,
        "temps": 5,
        "symbolic": "pass"
      },
      {
        "id": "c6",
        "ops": {
          "add": 12,
          "mul": 4
        },
        "depth": 4,
        "temps": 5,
        "symbolic": "pass"
      },
      {
        "id": "c7",
        "ops": {
          "add": 12,
          "mul": 6
        },
        "depth": 3,
        "temps": 5,
        "symbolic": "pass"
      },
      {
        "id": "c8",
        "ops": {
          "add": 13,
          "mul": 5
        },
        "depth": 4,
        "temps": 5,
        "symbolic": "pass"
      }
    ],
    "shortlist": [
      "c1"
    ]
  },
  "candidates": [
    {
      "id": "c1",
      "program": {
        "field": "gf256",
        "instructions": [
          {
            "a": 0,
            "b": 1,
            "op": "add"
          },
          {
            "a": 4,
            "k": "02",
            "op": "mul"
          },
          {
            "a": 2,
            "b": 3,
            "op": "add"
          },
          {
            "a": 1,
            "b": 6,
            "op": "add"
          },
          {
            "a": 5,
            "b": 7,
            "op": "add"
          },
          {
            "a": 1,
            "b": 2,
            "op": "add"
          },
          {
            "a": 9,
            "k": "02",
            "op": "mul"
          },
          {
            "a": 0,
            "b": 6,
            "op": "add"
          },
          {
            "a": 10,
            "b": 11,
            "op": "add"
          },
          {
            "a": 6,
            "k": "02",
            "op": "mul"
          },
          {
            "a": 3,
            "b": 4,
            "op": "add"
          },
          {
            "a": 13,
            "b": 14,
            "op": "add"
          },
          {
            "a": 0,
            "b": 3,
            "op": "add"
          },
          {
            "a": 16,
            "k": "02",
            "op": "mul"
          },
          {
            "a": 2,
            "b": 4,
            "op": "add"
          },
          {
            "a": 17,
            "b": 18,
            "op": "add"
          }
        ],
        "outputs": [
          8,
          12,
          15,
          19
        ],
        "width": 4
      },
      "origin": "search",
      "equivalence": {
        "id": "circuit.equivalence",
        "chain": "implementation",
        "title": "Circuit computes the design matrix",
        "status": "proved",
        "evidence": {
          "kind": "lean",
          "label": "Lean-checked circuit equivalence",
          "theorem": "CryptificateJob.circuit_equivalence",
          "type": "CryptificateJob.candProgram.WellFormed ∧ ∀ (x : Fin 4 → GF256), CryptificateJob.candProgram.eval x = CryptificateJob.candMatrix.mulVec x",
          "axioms": [
            "propext",
            "Classical.choice",
            "Quot.sound"
          ]
        },
        "witness": null,
        "note": "Lean checked CryptificateJob.circuit_equivalence using only the standard axioms."
      },
      "native": {
        "cases": 9214,
        "passed": true,
        "checksum": "sha256:f74c1c30a4a4450b5ca2e6098c6994b526326ccae711f4aa1197a5253f14fe77"
      }
    },
    {
      "id": "baseline-direct",
      "program": {
        "field": "gf256",
        "instructions": [
          {
            "a": 0,
            "k": "02",
            "op": "mul"
          },
          {
            "a": 1,
            "k": "02",
            "op": "mul"
          },
          {
            "a": 2,
            "k": "02",
            "op": "mul"
          },
          {
            "a": 3,
            "k": "02",
            "op": "mul"
          },
          {
            "a": 4,
            "b": 1,
            "op": "add"
          },
          {
            "a": 8,
            "b": 5,
            "op": "add"
          },
          {
            "a": 9,
            "b": 2,
            "op": "add"
          },
          {
            "a": 10,
            "b": 3,
            "op": "add"
          },
          {
            "a": 0,
            "b": 5,
            "op": "add"
          },
          {
            "a": 12,
            "b": 2,
            "op": "add"
          },
          {
            "a": 13,
            "b": 6,
            "op": "add"
          },
          {
            "a": 14,
            "b": 3,
            "op": "add"
          },
          {
            "a": 0,
            "b": 1,
            "op": "add"
          },
          {
            "a": 16,
            "b": 6,
            "op": "add"
          },
          {
            "a": 17,
            "b": 3,
            "op": "add"
          },
          {
            "a": 18,
            "b": 7,
            "op": "add"
          },
          {
            "a": 0,
            "b": 4,
            "op": "add"
          },
          {
            "a": 20,
            "b": 1,
            "op": "add"
          },
          {
            "a": 21,
            "b": 2,
            "op": "add"
          },
          {
            "a": 22,
            "b": 7,
            "op": "add"
          }
        ],
        "name": "direct-primitive",
        "outputs": [
          11,
          15,
          19,
          23
        ],
        "width": 4
      },
      "origin": "baseline-direct",
      "equivalence": {
        "id": "circuit.equivalence",
        "chain": "implementation",
        "title": "Circuit computes the design matrix",
        "status": "proved",
        "evidence": {
          "kind": "lean",
          "label": "Lean-checked circuit equivalence",
          "theorem": "CryptificateJob.circuit_equivalence",
          "type": "CryptificateJob.candProgram.WellFormed ∧ ∀ (x : Fin 4 → GF256), CryptificateJob.candProgram.eval x = CryptificateJob.candMatrix.mulVec x",
          "axioms": [
            "propext",
            "Classical.choice",
            "Quot.sound"
          ]
        },
        "witness": null,
        "note": "Lean checked CryptificateJob.circuit_equivalence using only the standard axioms."
      },
      "native": {
        "cases": 9214,
        "passed": true,
        "checksum": "sha256:f74c1c30a4a4450b5ca2e6098c6994b526326ccae711f4aa1197a5253f14fe77"
      }
    },
    {
      "id": "baseline-known",